Question_ID,refence_text,answer_cut,words_num
36,动物细胞具有不规则形状，而植物细胞具有固定形状。植物细胞具有细胞壁，因为它是排他性的。动物细胞没有液泡，质体和乙醛酸体。,动物细胞 具有 不规则 形状 而 植物 细胞 具有 固定 形状 植物 细胞 具有 细胞壁 因为 它 是 排他性 的 动物细胞 没有 液泡 质体 和 乙醛酸 体 ,26
36,在植物中，除质膜外，细胞还具有在其外部排列的壁。该细胞壁主要由纤维素形成，可确保对植物细胞具有更大的抵抗力，避免因水分入侵而破裂,在 植物 中 除 质膜 外 细胞 还 具有 在 其 外部 排列 的 壁 该 细胞壁 主要 由 纤维素 形成 可 确保 对 植物 细胞 具有 更大 的 抵抗力 避免 因 水分 入侵 而 破裂 ,36
36,在植物细胞中有叶绿体，纤维素细胞壁和搏动性空泡,在 植物 细胞 中有 叶绿体 纤维素 细胞壁 和 搏动 性 空泡 ,11
36,动植物细胞具有不同的形状。动物细胞具有不规则形状，而植物细胞具有固定形状。,动植物 细胞 具有 不同 的 形状 动物细胞 具有 不规则 形状 而 植物 细胞 具有 固定 形状 ,16
36,动物细胞是指构成动物界中所有生物的细胞，由质膜，细胞质和真核组成。植物细胞含有诸如细胞壁，质体和大液泡的结构,动物细胞 是 指 构成 动物界 中 所有 生物 的 细胞 由 质膜 细胞质 和 真核 组成 植物 细胞 含有 诸如 细胞壁 质体 和 大 液泡 的 结构 ,27
36,空泡，质体和细胞壁的存在,空泡 质体 和 细胞壁 的 存在 ,6
36,细胞壁是植物细胞的独特结构。它对应于质膜外部的包装纸。,细胞壁 是 植物 细胞 的 独特 结构 它 对应 于 质膜 外部 的 包装纸 ,14
36,在将植物细胞与动物区分开的差异中，我们可以突出显示液泡，质体和细胞壁的存在。在细胞质中，一些细胞器是动植物细胞共有的。,在 将 植物 细胞 与 动物 区分 开 的 差异 中 我们 可以 突出 显示 液泡 质体 和 细胞壁 的 存在 在 细胞质 中 一些 细胞器 是 动植物 细胞 共有 的 ,31
37,细胞质：位于细胞核和质膜之间，在细胞质中存在细胞质\\质膜：保护并界定细胞\\细胞核：保留所有信息，例如DNA和RNA,细胞质 位于 细胞核 和 质膜 之间 在 细胞质 中 存在 细胞质 质膜 保护 并 界定 细胞 细胞核 保留 所有 信息 例如 DNA 和 RNA ,24
37,质膜：选择进入细胞和离开细胞的细胞。\细胞器：每个具有特定功能以确保细胞正常运行\细胞质：细胞内部细胞器和细胞核的位置\细胞核：DNA或RNA的储存位置。,质膜 选择 进入 细胞 和 离开 细胞 的 细胞 细胞器 每个 具有 特定 功能 以 确保 细胞 正常 运行 细胞质 细胞 内部 细胞器 和 细胞核 的 位置 细胞核 DNA 或 RNA 的 储存 位置 ,34
37,单元具有许多部分，每个部分具有不同的功能。其中一些部分称为细胞器，是在细胞内执行某些任务的专门结构。,单元 具有 许多 部分 每个 部分 具有 不同 的 功能 其中 一些 部分 称为 细胞器 是 在 细胞 内 执行 某些 任务 的 专门 结构 ,25
37,核：存储DNA并控制细胞\细胞质：位于质膜和细胞核之间的液体，细胞器位于细胞核所在的位置，也可以保护细胞核\质膜：发挥过滤器的功能，选择进入并离开细胞的细胞。,核 存储 DNA 并 控制 细胞 细胞质 位于 质膜 和 细胞核 之间 的 液体 细胞器 位于 细胞核 所在 的 位置 也 可以 保护 细胞核 质膜 发挥 过滤器 的 功能 选择 进入 并 离开 细胞 的 细胞 ,36
37,该细胞具有：细胞核，遗传物质位于（有组织的或无组织的）核；内质网，粗糙的网状结构，负责蛋白质的运输和平滑的合成，负责运输；线粒体，负责产生能量；高尔基体复合体，负责物质的分泌；半透性质膜等,该 细胞 具有 细胞核 遗传物质 位于 有 组织 的 或 无 组织 的 核 内质网 粗糙 的 网状结构 负责 蛋白质 的 运输 和 平滑 的 合成 负责 运输 线粒体 负责 产生 能量 高尔基体 复合体 负责 物质 的 分泌 半透 性质 膜 等 ,42
37,所有细胞都具有细胞膜（选择性渗透性），核糖体（蛋白质合成），胞质溶胶（发生化学反应的地方，充满）和遗传物质。除这些细胞器外，动物细胞还具有：线粒体（细胞呼吸），光滑的内质网（物质的运输和脂质的产生），粗糙的内质网（蛋白质的运输和产生），高尔基体复合物（存储和分泌），细胞骨架（结构） ），溶酶体（消化）和中心粒（鞭毛e）。,所有 细胞 都 具有 细胞膜 选择性 渗透性 核糖体 蛋白质 合成 胞质溶胶 发生 化学反应 的 地方 充满 和 遗传物质 除 这些 细胞器 外 动物细胞 还 具有 线粒体 细胞 呼吸 光滑 的 内质网 物质 的 运输 和 脂质 的 产生 粗糙 的 内质网 蛋白质 的 运输 和 产生 高尔基体 复合物 存储 和 分泌 细胞骨架 结构 溶酶体 消化 和 中心粒 鞭毛 e ,59
37,细胞由细胞膜，细胞质和细胞核组成。膜保护细胞并允许其与其环境之间的交换，细胞质通常是细胞的最大部分。它包括质膜和细胞核之间的区域。,细胞 由 细胞膜 细胞质 和 细胞核 组成 膜 保护 细胞 并 允许 其 与其 环境 之间 的 交换 细胞质 通常 是 细胞 的 最大 部分 它 包括 质膜 和 细胞核 之间 的 区域 ,33
37,等离子体膜：细胞的外壳，调节细胞与外部环境之间的物质交换。\\\\\\\\\ \ \ \ \ \ \ \ \ \ \ \ \ \ \ \ \ \ \ \ \ \ \ \ \ \ \ \ \ \ \ \ \ \ \ \ \ \ \ \ \ \ \ \ \ \ \ \ \ \ \ \ \ \ \ \ \ \ \ \ \ \ \ \ \ \ \ \ \ \ \ \ \ \ \ \ \ \ \ \ \ \ \ \ \ \ \ \ \ \ \ \ \ \ \ \ \ \ \ \ \ \ \ \ \ \ \ \ \ \ \ \ \ \ \ \ \ \ \ \ \ \ \ \ \ \ \ \ \ \ \ \ \\\\\\\\\\\\小数到一：细胞内的一种胶状物质，其中浸入了几种较小的类器官。细胞质是渗透细胞的物质（例如营养物质）发生转化的地方。\\ NUCLEUS：与细胞功能和细胞增殖的协调有关的结构。DNA存在于细胞核中。,等离子体 膜 细胞 的 外壳 调节 细胞 与 外部环境 之间 的 物质 交换 小数 到 一 细胞 内 的 一种 胶状 物质 其中 浸入 了 几种 较 小 的 类 器官 细胞质 是 渗透 细胞 的 物质 例如 营养物质 发生 转化 的 地方 NUCLEUS 与 细胞 功能 和 细胞 增殖 的 协调 有关 的 结构 DNA 存在 于 细胞核 中 ,60
38,细胞之间缺乏空间，缺乏血管形成和细胞更新，并且能够保护人体免受病毒和面包店的侵害,细胞 之间 缺乏 空间 缺乏 血管 形成 和 细胞 更新 并且 能够 保护 人体 免受 病毒 和 面包店 的 侵害 ,20
38,上皮组织的特点是细胞间物质少，细胞呈高度统一,上皮组织 的 特点 是 细胞 间 物质 少 细胞 呈 高度 统一 ,12
38,上皮组织的主要特征是几乎没有细胞间质和并置的细胞,上皮组织 的 主要 特征 是 几乎 没有 细胞 间质 和 并 置 的 细胞 ,14
38,它们是由附近的单元形成的，它们迅速相互替换。,它们 是 由 附近 的 单元 形成 的 它们 迅速 相互 替换 ,12
38,上皮组织有3层，其再生快，细胞间液少，位于汗腺中，该组织形成皮肤。,上皮组织 有 层 其 再生 快 细胞 间 液少 位于 汗腺 中 该 组织 形成 皮肤 ,16
38,防护，涂层。,防护 涂层 ,2
38,上皮组织具有以下特征：细胞之间缺乏空间，缺乏血管形成和优异的细胞更新能力。,上皮组织 具有 以下 特征 细胞 之间 缺乏 空间 缺乏 血管 形成 和 优异 的 细胞 更新 能力 ,17
38,上皮组织负责覆盖我们的整个身体（皮肤），包括我们的内部器官（消化系统，呼吸系统和泌尿系统的器官）。,上皮组织 负责 覆盖 我们 的 整个 身体 皮肤 包括 我们 的 内部 器官 消化系统 呼吸系统 和 泌尿系统 的 器官 ,19
39,新陈代谢\这些反应可能与有机化合物的合成或它们分解成ATP的反应有关，并且都由酶协调。代谢对于维持我们机体的所有活动至关重要。,新陈代谢 这些 反应 可能 与 有机 化合物 的 合成 或 它们 分解成 ATP 的 反应 有关 并且 都 由 酶 协调 代谢 对于 维持 我们 机体 的 所有 活动 至关重要 ,30
39,细胞代谢使活生物体中的所有细胞都能正确执行其功能，为此创造了必要的能量。,细胞 代谢 使活 生物体 中 的 所有 细胞 都 能 正确 执行 其 功能 为此 创造 了 必要 的 能量 ,20
39,代谢是ATP需要发生的反应，所有细胞都参与通过刺激使我们的身体发挥功能,代谢 是 ATP 需要 发生 的 反应 所有 细胞 都 参与 通过 刺激 使 我们 的 身体 发挥 功能 ,19
39,细胞代谢-这些化学反应发生在体内以消耗能量。,细胞 代谢 这些 化学反应 发生 在 体内 以 消耗 能量 ,10
39,细胞代谢是生物体中的一组化学反应，会产生能量以使细胞发挥功能。,细胞 代谢 是 生物体 中 的 一组 化学反应 会 产生 能量 以 使 细胞 发挥 功能 ,16
39,细胞中发生的所有化学反应的集合。这些反应负责细胞中营养物质的合成和降解过程，并构成生命的基础，使细胞得以生长和繁殖。,细胞 中 发生 的 所有 化学反应 的 集合 这些 反应 负责 细胞 中 营养物质 的 合成 和 降解 过程 并 构成 生命 的 基础 使 细胞 得以 生长 和 繁殖 ,30
39,细胞的新陈代谢，可分为合成代谢（合成）和分解代谢（分解）。,细胞 的 新陈代谢 可 分为 合成 代谢 合成 和 分解代谢 分解 ,11
39,代谢发生在细胞内，产生ATP（能量），并取决于食物，呼吸等。,代谢 发生 在 细胞 内 产生 ATP 能量 并 取决于 食物 呼吸 等 ,13
40,基因型可以定义为个体的遗传组成，即从父亲和母亲那里获得的一组基因。这些基因，再加上环境的影响，将决定一个生物的表型。,基因型 可以 定义 为 个体 的 遗传 组成 即 从 父亲 和 母亲 那里 获得 的 一组 基因 这些 基因 再 加上 环境 的 影响 将 决定 一个 生物 的 表型 ,31
40,-基因型：个体的遗传构成。-表型：个体的生理，形态甚至行为特征。,基因型 个体 的 遗传 构成 表型 个体 的 生理 形态 甚至 行为 特征 ,13
40,基因型是指共同祖先个体的遗传构成，定义了物种的特征。表型是物理，形态甚至行为特征。,基因型 是 指 共同 祖先 个体 的 遗传 构成 定义 了 物种 的 特征 表型 是 物理 形态 甚至 行为 特征 ,21
40,基因型是DNA的内在特征，表型是可以被修饰的外在特征,基因型 是 DNA 的 内在 特征 表型 是 可以 被 修饰 的 外 在 特征 ,15
40,表型可以改变（通过环境，通过我们的习惯或通过我们的意志），而基因型是不可变的，直到我们寿终正寝。,表型 可以 改变 通过 环境 通过 我们 的 习惯 或 通过 我们 的 意志 而 基因型 是 不可 变 的 直到 我们 寿终正寝 ,23
40,该表型对应于生物的生理，生理或行为特征。基因型对应于个体的遗传组成。,该 表型 对应 于 生物 的 生理 生理 或 行为 特征 基因型 对应 于 个体 的 遗传 组成 ,18
40,基因型-基因集\表型-可以修改的可见特征,基因型 基因 集 表型 可以 修改 的 可见 特征 ,9
40,该表型对应于生物的生理，生理或行为特征。基因型对应于个体的遗传构成，加上环境影响，可以决定其表型。在MN血液系统的情况下，例如，表型是组M，N和MN。与这些表型相对应的基因型分别是MM，NN和MN。具有血型M表型的人具有MM基因对作为基因型。,该 表型 对应 于 生物 的 生理 生理 或 行为 特征 基因型 对应 于 个体 的 遗传 构成 加上 环境影响 可以 决定 其 表型 在 MN 血液 系统 的 情况 下 例如 表型 是 组 M N 和 MN 与 这些 表型 相对 应 的 基因型 分别 是 MM NN 和 MN 具有 血型 M 表型 的 人 具有 MM 基因 对 作为 基因型 ,64
41,这意味着父母的特征会传递给孩子,这 意味着 父母 的 特征 会 传递 给 孩子 ,9
41,是父母的特征吗？例如，一个人必须戴眼镜，但这不是因为视力问题，而是因为父母有这些问题，而这个问题来自基因,是 父母 的 特征 吗 例如 一个 人 必须 戴眼镜 但 这 不是 因为 视力 问题 而是 因为 父母 有 这些 问题 而 这个 问题 来自 基因 ,27
41,她父母的基因传给了她的孩子,她 父母 的 基因 传给 了 她 的 孩子 ,9
41,这就是遗传特征从父母传给孩子的方式。,这 就是 遗传 特征 从 父母 传给 孩子 的 方式 ,10
41,遗传特征的传递是当父母的DNA中存在的特征传递给孩子时。,遗传 特征 的 传递 是 当 父母 的 DNA 中 存在 的 特征 传递 给 孩子 时 ,17
41,它负责遗传因子的传播，这些遗传因子决定了给定物种共有的特征的遗传。,它 负责 遗传因子 的 传播 这些 遗传因子 决定 了 给定 物种 共有 的 特征 的 遗传 ,16
41,遗传特性的传递就是通过从父母传递给子女的基因来进行的。,遗传 特性 的 传递 就是 通过 从 父母 传递 给 子女 的 基因 来 进行 的 ,16
41,“将持续到我们的时代结束”的特征（生理或心理）的传递,将 持续 到 我们 的 时代 结束 的 特征 生理 或 心理 的 传递 ,14
42,它们是前列腺，输精管，尿道和附睾。它们产生，滋养和运输精子。,它们 是 前列腺 输精管 尿道 和 附睾 它们 产生 滋养 和 运输 精子 ,13
42,内部器官用于产生和运输繁殖所必需的元素。,内部 器官 用于 产生 和 运输 繁殖 所 必需 的 元素 ,11
42,前列腺是一种可以帮助养育精子的腺体，附睾和输精管是可以帮助运送精子的通道，尿道可以将尿液和精液排出体外。,前列腺 是 一种 可以 帮助 养育 精子 的 腺体 附睾 和 输精管 是 可以 帮助 运送 精子 的 通道 尿道 可以 将 尿液 和 精液 排出 体外 ,27
42,睾丸（激素和精子的产生），前列腺，输尿管和不同的导管。,睾丸 激素 和 精子 的 产生 前列腺 输尿管 和 不同 的 导管 ,12
42,男性的内部性器官是：睾丸，附睾，不同的导管，精囊，前列腺，球脑腺和尿道。青春期后，由盘绕的曲细精管形成的睾丸开始产生。精子和睾丸激素。这些生殖细胞（精子）形成后，被引导到附睾的单个管中，在那里它们将成熟，储存并获得运动性（通过鞭毛节拍）和顶体（在受精过程中穿透卵母细胞）。随后，精子将被运送通过输精管，精子和前列腺液将分别从精囊和前列腺中流出。当这种液体和细胞的混合物到达尿道时，由于其尿液也通过相同的通道运输，因此，球脑腺分泌其液体以清洁精液通过的通道。因此，尿道将精液转移到生物体的外部环境。,男性 的 内部 性器官 是 睾丸 附睾 不同 的 导管 精囊 前列腺 球脑腺 和 尿道 青春期 后 由 盘绕 的 曲细精 管 形成 的 睾丸 开始 产生 精子 和 睾丸 激素 这些 生殖细胞 精子 形成 后 被 引导 到 附睾 的 单个 管中 在 那里 它们 将 成熟 储存 并 获得 运动性 通过 鞭毛 节拍 和 顶体 在 受精 过程 中 穿透 卵母细胞 随后 精子 将 被 运送 通过 输精管 精子 和 前列腺 液 将 分别 从 精囊 和 前列腺 中 流出 当 这种 液体 和 细胞 的 混合物 到达 尿道 时 由于 其 尿液 也 通过 相同 的 通道 运输 因此 球脑腺 分泌 其 液体 以 清洁 精液 通过 的 通道 因此 尿道 将 精液 转移 到 生物体 的 外部环境 ,121
42,睾丸：负责精子的产生；前列腺：产生与精子一起组成精液的液体，并帮助精子在阴道管中运动。尿道：排出精液和尿液的通道,睾丸 负责 精子 的 产生 前列腺 产生 与 精子 一起 组成 精液 的 液体 并 帮助 精子 在 阴道 管中 运动 尿道 排出 精液 和 尿液 的 通道 ,28
42,睾丸-负责精子的产生。前列腺-产生与精子一起组成精液的液体，并帮助该细胞运动。尿道-排出精液和尿液的通道,睾丸 负责 精子 的 产生 前列腺 产生 与 精子 一起 组成 精液 的 液体 并 帮助 该 细胞 运动 尿道 排出 精液 和 尿液 的 通道 ,26
42,睾丸产生精子并传递到附睾成熟，它们已经在输精管中成熟。在唤醒过程中，它们被带到尿道并从那里射出。在此过程中，它会从囊泡腺和前列腺中吸收液体。,睾丸 产生 精子 并 传递 到 附睾 成熟 它们 已经 在 输精管 中 成熟 在 唤醒 过程 中 它们 被 带到 尿道 并 从 那里 射 出 在 此 过程 中 它会 从 囊 泡腺 和 前列腺 中 吸收 液体 ,40
43,吸气是允许空气进入肺部的一系列运动。呼气是一组运动，导致从气道内部排出空气。在这种情况下，肋间肌肉和the肌松弛。,吸气 是 允许 空气 进入 肺部 的 一系列 运动 呼气 是 一组 运动 导致 从 气道 内部 排出 空气 在 这种 情况 下 肋间肌 肉 和 the 肌 松弛 ,29
43,灵感：隔膜下降；肋间合同；胸部 增加音量；降低压力。到期时间：隔膜上升；肋间放松；胸部下降；减少音量；增加压力,灵感 隔膜 下降 肋间 合同 胸部 增加 音量 降低 压力 到期 时间 隔膜 上升 肋间 放松 胸部 下降 减少 音量 增加 压力 ,22
43,吸气时，肋间肌肉和the肌收缩，增加了肋骨的体积，降低了内部压力并使空气进入。呼气时，肋间肌肉和横and膜松弛，减少胸部体积，增加内部压力并排出空气。,吸气 时 肋间肌 肉 和 the 肌 收缩 增加 了 肋骨 的 体积 降低 了 内部 压力 并 使 空气 进入 呼气 时 肋间肌 肉 和 横 and 膜 松弛 减少 胸部 体积 增加 内部 压力 并 排出 空气 ,39
43,鼓舞人心：空气进入鼻腔通道，穿过肺部，并通过隔膜的收缩而排出。当收缩时，隔膜下降，这随着肋间肌肉的运动而增加了胸部的体积，导致内部压力降低并变得小于大气压。这样，空气便会通过肺部渗透。\经验：The肌和肋间肌肉松弛，这减少了胸腔的容积并将排出的空气排出。,鼓舞人心 空气 进入 鼻腔 通道 穿过 肺部 并 通过 隔膜 的 收缩 而 排出 当 收缩 时 隔膜 下降 这 随着 肋间肌 肉 的 运动 而 增加 了 胸部 的 体积 导致 内部 压力 降低 并 变得 小于 大气压 这样 空气 便会 通过 肺部 渗透 经验 The 肌 和 肋间肌 肉 松弛 这 减少 了 胸腔 的 容积 并 将 排出 的 空气 排出 ,64
43,空气进入鼻腔，穿过肺部，并通过隔膜的收缩而排出。呼气时，the肌和肋间肌肉放松，将用过的空气排出。,空气 进入 鼻腔 穿过 肺部 并 通过 隔膜 的 收缩 而 排出 呼气 时 the 肌 和 肋间肌 肉 放松 将 用 过 的 空气 排出 ,26
43,在吸气过程中，肋间肌肉和the肌收缩，从而降低内部压力，导致空气进入。呼气时，它们会通过增加压力并排出空气而放松。,在 吸气 过程 中 肋间肌 肉 和 the 肌 收缩 从而 降低 内部 压力 导致 空气 进入 呼气 时 它们 会 通过 增加 压力 并 排出 空气 而 放松 ,29
43,吸气：空气通过鼻腔进入，穿过肺部，并通过隔膜的收缩而排出。收缩时，the肌下降，并随着肋间肌肉的运动，增大胸部的体积，从而产生大气压。这样，空气就会渗透到肺部。呼气：The肌和肋间肌肉松弛，这会减少胸部体积并排出使用过的空气。,吸气 空气 通过 鼻腔 进入 穿过 肺部 并 通过 隔膜 的 收缩 而 排出 收缩 时 the 肌 下降 并 随着 肋间肌 肉 的 运动 增大 胸部 的 体积 从而 产生 大气压 这样 空气 就 会 渗透到 肺部 呼气 The 肌 和 肋间肌 肉 松弛 这会 减少 胸部 体积 并 排出 使用 过 的 空气 ,55
43,灵感。空气进入鼻腔通道，穿过肺部，并通过隔膜的收缩而排出。到期时间。横diaphragm膜和肌肉放松，这会减少胸部的体积并排出用过的空气。,灵感 空气 进入 鼻腔 通道 穿过 肺部 并 通过 隔膜 的 收缩 而 排出 到期 时间 横 diaphragm 膜 和 肌肉 放松 这会 减少 胸部 的 体积 并 排出 用过 的 空气 ,32
44,在这段没有呼吸的时期，动脉血仍在运输，富含O2，但一点一点地，CO2的量增加，血液的pH值降低，并诱导球茎刺激呼吸的恢复。,在 这段 没有 呼吸 的 时期 动脉血 仍 在 运输 富含 O 但 一点一点 地 CO 的 量 增加 血液 的 pH 值 降低 并 诱导 球茎 刺激 呼吸 的 恢复 ,31
44,为什么大脑会识别出多余的二氧化碳并迫使我们再次呼吸。,为什么 大脑 会 识别 出 多余 的 二氧化碳 并 迫使 我们 再次 呼吸 ,13
44,因为我们的身体有反应，它迫使我们呼吸,因为 我们 的 身体 有 反应 它 迫使 我们 呼吸 ,10
44,有一个叫做“ requidian电灯泡”的器官可以控制您的血液中二氧化碳的含量。当您屏住呼吸时，血液中的二氧化碳含量会增加，并且当达到一定极限时，灯泡会迫使您呼吸。,有 一个 叫做 requidian 电灯泡 的 器官 可以 控制 您 的 血液 中 二氧化碳 的 含量 当 您 屏住 呼吸 时 血液 中 的 二氧化碳 含量 会 增加 并且 当 达到 一定 极限 时 灯泡 会 迫使 您 呼吸 ,39
44,因为我们的大脑不允许我们这样做，因为这是非自愿行为,因为 我们 的 大脑 不 允许 我们 这样 做 因为 这 是非 自愿 行为 ,14
44,因为当您停止呼吸时，血液中二氧化碳的浓度会增加。在一定水平之后，神经系统恢复命令呼吸，该人再次开始吸气和呼气的过程。,因为 当 您 停止 呼吸 时 血液 中 二氧化碳 的 浓度 会 增加 在 一定 水平 之后 神经系统 恢复 命令 呼吸 该 人 再次 开始 吸气 和 呼气 的 过程 ,30
44,血液中的二氧化碳含量会增加，当达到一定极限时，灯泡会迫使您呼吸。,血液 中 的 二氧化碳 含量 会 增加 当 达到 一定 极限 时 灯泡 会 迫使 您 呼吸 ,17
44,有一个叫做脊髓球的器官可以（非自愿地）控制您的血液二氧化碳速率。当呼吸停止时，该器官迫使返回作为对生物体的一种保护形式。,有 一个 叫做 脊髓 球 的 器官 可以 非 自愿地 控制 您 的 血液 二氧化碳 速率 当 呼吸 停止 时 该 器官 迫使 返回 作为 对 生物体 的 一种 保护 形式 ,31
45,仅在白细胞中，因为当红细胞成熟时，它们失去细胞核，不再携带染色体。,仅 在 白细胞 中 因为 当 红细胞 成熟 时 它们 失去 细胞核 不再 携带 染色体 ,15
45,它必须在白细胞中进行，因为在红细胞中它没有核。,它 必须 在 白细胞 中 进行 因为 在 红细胞 中 它 没有 核 ,13
45,白细胞是唯一包含细胞核的细胞，可以携带遗传物质染色体,白细胞 是 唯一 包含 细胞核 的 细胞 可以 携带 遗传物质 染色体 ,11
45,不可以，因为与血细胞异常不同，白细胞具有细胞核，并且是遗传物质，存在于细胞核中。,不 可以 因为 与 血细胞 异常 不同 白细胞 具有 细胞核 并且 是 遗传物质 存在 于 细胞核 中 ,17
45,白细胞，因为它们是具有核和染色体的血细胞。,白细胞 因为 它们 是 具有 核 和 染色体 的 血细胞 ,10
45,在细胞核中发现了染色体，而红细胞没有核。那么这项研究应该在白细胞上完成,在 细胞核 中 发现 了 染色体 而 红细胞 没有 核 那么 这项 研究 应该 在 白细胞 上 完成 ,18
45,不，因为与红细胞不同，白细胞具有核。而且，由于在细胞核中发现了遗传物质，因此不可能使用红血球研究染色体。,不 因为 与 红细胞 不同 白细胞 具有 核 而且 由于 在 细胞核 中 发现 了 遗传物质 因此 不 可能 使用 红血球 研究 染色体 ,23
45,在白细胞中，因为它们具有细胞核。而且由于遗传物质是在细胞核中发现的，所以它一定是白细胞，因为红细胞没有核。,在 白细胞 中 因为 它们 具有 细胞核 而且 由于 遗传物质 是 在 细胞核 中 发现 的 所以 它 一定 是 白细胞 因为 红细胞 没有 核 ,25
46,动脉离开心脏，并在分支时变得越来越细。这些血管的主要功能是将血液以及因此的营养和氧气从心脏输送到组织，静脉将血液从身体输送到心脏，以便可以将其泵回体内。,动脉 离开 心脏 并 在 分支 时 变得 越来越 细 这些 血管 的 主要 功能 是 将 血液 以及 因此 的 营养 和 氧气 从 心脏 输送到 组织 静脉 将 血液 从 身体 输送到 心脏 以便 可以 将 其泵回 体内 ,40
46,动脉是血管，负责将血液带出心脏，并携带富含O2的动脉血。静脉负责将血液从组织输送到心脏，在心脏中富含二氧化碳，并输送静脉血液。,动脉 是 血管 负责 将 血液 带 出 心脏 并 携带 富含 O 的 动脉血 静脉 负责 将 血液 从 组织 输送到 心脏 在 心脏 中 富含 二氧化碳 并 输送 静脉 血液 ,32
